{
  "$schema": "./proof-of-protection.schema.json",
  "schemaVersion": "tinjau.proof-of-protection/1.0.0",
  "producedByTask": "T5.5",
  "recordId": "pop-B-confirmed-protect-xlayer-testnet-1952-demo-envelope",
  "_READ_THIS_FIRST": [
    "THIS RECORD DEMONSTRATES ENFORCEMENT, NOT BENEFIT.",
    "No replayed scenario produced a PROTECT. The only observed PROTECT interval that exists anywhere in this project is the one below, and its MARKET LEG IS CONSTRUCTED on a BUILDER-CONTROLLED X Layer Testnet pool seeded with valueless mock tokens.",
    "The canonical replay of this same 8-K resolves to WATCH, because its market leg is NOT_CONFIRMED (T3.3, published). See `canonicalReplayOfThisEvent`.",
    "canClaimLossAvoided is FALSE. Nothing here may be presented as evidence that an intervention helped an LP, because no measured event warranted an intervention.",
    "`observedOnChainProtection` and `replayedCounterfactualBaselines` are different chains, different pools, and different epistemic status. They must never be combined into one figure or shown with one visual treatment."
  ],
  "derivedFrom": {
    "onChainRun": {
      "artifact": "t4-demo-manifest-xlayer-testnet.json",
      "runAt": "2026-08-21T03:57:59.774Z",
      "addressStatus": "T4.2 working addresses — not final; T7.2 owns the authoritative list"
    },
    "benchmark": {
      "artifact": "three-policy-benchmark.json",
      "schemaVersion": "tinjau.three-policy-benchmark/1.0.0",
      "producedByTasks": [
        "T5.1",
        "T5.2",
        "T5.3",
        "T5.4"
      ]
    },
    "frozenScenario": {
      "artifact": "apps/server/scenarios/scenario-b-confirmed-protect.json",
      "schemaVersion": "tinjau.scenario/0.2.0",
      "scenarioId": "B-confirmed-protect",
      "frozenAt": "2026-08-20",
      "frozenByTask": "T0.2"
    },
    "_determinism": "Every field below is derived from those three artifacts. No wall-clock time is read, so re-running the generator produces a byte-identical file and an empty diff is meaningful evidence."
  },
  "trigger": {
    "inputIdentity": {
      "scenarioId": "B-confirmed-protect",
      "title": "Confirmed protection — NVIDIA 8-K, $105bn residual value guaranties, PORTS-Pike",
      "decisionAnchor": {
        "at": "2026-08-17T12:41:33Z",
        "blockNumber": "68201457",
        "why": "EDGAR acceptance timestamp of accession 0001045810-26-000069, cross-checked against the filing directory's last-modified stamp of 2026-08-17 08:41:33 US/Eastern.",
        "usReferenceMarketOpen": false,
        "usReferenceMarketNote": "12:41:33Z is 08:41:33 US/Eastern — Monday pre-market, 49 minutes before the 13:30Z regular-session open. The X Layer wNVDAx/USDG pool was trading."
      },
      "evidenceWindow": {
        "rule": "anchor minus 72 hours .. anchor",
        "from": "2026-08-14T12:41:33Z",
        "to": "2026-08-17T12:41:33Z",
        "_completeness": "Every claim about this asset found in the public record inside this window is listed below, including both non-official clusters. Nothing in-window was omitted to make the official path look cleaner."
      },
      "canonicalAsset": {
        "company": "NVIDIA CORPORATION",
        "cik": "0001045810",
        "ticker": "NVDA",
        "tokenSymbol": "wNVDAx",
        "tokenAddress": "0xa8ddb5cd96b5222afe198316e9a57caa642850d5",
        "chainId": 196,
        "chainName": "X Layer mainnet",
        "poolIdOrAddress": "0x2a2b11730c2b6d99a58034a869dd810d7300a7b2"
      },
      "preRegisteredExpectation": "Selected on evidence quality, event materiality, and market-data availability only. The pool's price path inside the replay window was deliberately NOT inspected before this file was frozen. See docs/buildx-orion-2026/outputs/04-planning/t0-2-frozen-scenarios.md §6."
    },
    "evidence": {
      "dataMode": "REPLAY",
      "claimCount": 6,
      "claims": [
        {
          "claimId": "claim-b-001",
          "sourceClass": "OFFICIAL",
          "dataMode": "REPLAY",
          "sourceUrl": "https://www.sec.gov/Archives/edgar/data/1045810/000104581026000069/nvda-20260817.htm",
          "sourceId": "edgar:0001045810-26-000069/nvda-20260817.htm",
          "publisherOrAuthor": "NVIDIA CORPORATION (SEC EDGAR filer, CIK 0001045810)",
          "publishedAt": "2026-08-17T12:41:33Z",
          "eventType": "MATERIAL_DEFINITIVE_AGREEMENT_AND_DIRECT_FINANCIAL_OBLIGATION",
          "materiality": "MATERIAL",
          "sourceContentSha256": "1c480e3320f3171e6ac1979a50eecb123d4150637c7b769444d16faf97928133"
        },
        {
          "claimId": "claim-b-002",
          "sourceClass": "OFFICIAL",
          "dataMode": "REPLAY",
          "sourceUrl": "https://www.sec.gov/Archives/edgar/data/1045810/000104581026000069/sbeoainvidia-portsrelease.htm",
          "sourceId": "edgar:0001045810-26-000069/sbeoainvidia-portsrelease.htm",
          "publisherOrAuthor": "NVIDIA CORPORATION (Exhibit 99.1, furnished under Item 7.01)",
          "publishedAt": "2026-08-17T12:41:33Z",
          "eventType": "MATERIAL_DEFINITIVE_AGREEMENT_AND_DIRECT_FINANCIAL_OBLIGATION",
          "materiality": "MATERIAL",
          "sourceContentSha256": "e3c39df5be133417c6f3b097cf6f81a5f502443bc4203eba55275fe2ad96f096"
        },
        {
          "claimId": "claim-b-003",
          "sourceClass": "NEWS",
          "dataMode": "REPLAY",
          "sourceUrl": null,
          "sourceId": "wsj/2026-08-14/nvidia-scales-back-ohio-guarantee",
          "publisherOrAuthor": "The Wall Street Journal",
          "publishedAt": "2026-08-14T00:00:00Z",
          "eventType": "CONTINGENT_FINANCIAL_OBLIGATION",
          "materiality": "MATERIAL"
        },
        {
          "claimId": "claim-b-004",
          "sourceClass": "NEWS",
          "dataMode": "REPLAY",
          "sourceUrl": "https://finance.yahoo.com/technology/ai/articles/nvidia-scales-back-250-billion-234356524.html",
          "sourceId": "reuters-via-yahoo/2026-08-14T23:43:56Z/nvidia-scales-back-guarantee",
          "publisherOrAuthor": "Reuters — Mrinmay Dey (syndicated by Yahoo Finance)",
          "publishedAt": "2026-08-14T23:43:56Z",
          "eventType": "CONTINGENT_FINANCIAL_OBLIGATION",
          "materiality": "MATERIAL"
        },
        {
          "claimId": "claim-b-005",
          "sourceClass": "NEWS",
          "dataMode": "REPLAY",
          "sourceUrl": "https://www.theinformation.com/articles/nvidia-talks-invest-3-billion-sb-energy-part-openai-data-center-deal",
          "sourceId": "theinformation.com/2026-08-15/nvidia-talks-invest-3-billion-sb-energy",
          "publisherOrAuthor": "The Information — Valida Pau, Ann Davis Vaughan, Phoebe Liu",
          "publishedAt": "2026-08-15T00:00:00Z",
          "eventType": "STRATEGIC_PARTNERSHIP_OR_INVESTMENT",
          "materiality": "MATERIAL"
        },
        {
          "claimId": "claim-b-006",
          "sourceClass": "NEWS",
          "dataMode": "REPLAY",
          "sourceUrl": "https://finance.yahoo.com/technology/ai/articles/nvidia-talks-invest-3-billion-193826586.html",
          "sourceId": "reuters-via-yahoo/2026-08-15T19:38:26Z/nvidia-talks-invest-3-billion",
          "publisherOrAuthor": "Reuters (syndicated by Yahoo Finance)",
          "publishedAt": "2026-08-15T19:38:26Z",
          "eventType": "STRATEGIC_PARTNERSHIP_OR_INVESTMENT",
          "materiality": "MATERIAL"
        }
      ],
      "_note": "The evidence leg is real and source-linked: SEC 8-K accession 0001045810-26-000069, primary document byte-committed. No claim in this scenario is SIMULATED. That is scenario A's rumour fixture, not this one."
    },
    "marketObservations": {
      "dataMode": "CONSTRUCTED",
      "_WARNING": "CONSTRUCTED. This price path was authored for the builder-controlled testnet pool because the real one does not confirm. It is not a market observation and no market conclusion may be drawn from it.",
      "whatWasConstructed": "The price path only. The path was scored by the real `confirmMarket` engine under its own frozen thresholds (rule tinjau.confirm/2.0.0), so the CONFIRMED verdict is the engine's, not a hand-set value.",
      "measuredExtentOfConstruction": {
        "onlyInCanonical": [
          "ANTI_WICK_FAILED",
          "MARKET_NOT_CONFIRMED"
        ],
        "onlyInConstructed": [
          "MARKET_CONFIRMED"
        ]
      },
      "_measuredExtentNote": "Reason-code diff against the canonical replay. All three differing codes are market-leg codes. Every evidence-leg conclusion is identical in both runs, asserted by test in the harness.",
      "confirmation": {
        "status": "CONFIRMED",
        "observedAt": "2026-08-21T03:51:15.000Z",
        "blockNumber": "68515239",
        "fresh": true,
        "antiWickSatisfied": true,
        "okxReferencePrice": null,
        "xLayerPoolPrice": "97",
        "basisBps": null,
        "drawdownBps": "300",
        "tradeVelocity": "0",
        "executableExitDepth": "14.93434387",
        "reasonCodes": [
          "MARKET_CONFIRMED",
          "MARKET_DATA_UNAVAILABLE",
          "REFERENCE_MARKET_CLOSED"
        ]
      },
      "okxLeg": {
        "status": "UNAVAILABLE",
        "_note": "No committed OKX index data covers this anchor (T3.1). This is a single-leg X Layer pool confirmation. No artifact may describe it as dual OKX/X Layer confirmation."
      }
    }
  },
  "selection": {
    "state": "PROTECT",
    "reasonCodes": [
      "BONDED_EVIDENCE_PASSED",
      "DUPLICATE_SYNDICATION",
      "MARKET_CONFIRMED",
      "OFFICIAL_FILING",
      "REFERENCE_MARKET_CLOSED",
      "STALE_EVIDENCE"
    ],
    "confidenceBand": "HIGH",
    "policyVersion": "tinjau.policy/1.0.0",
    "schemaVersion": "tinjau.risk/1.0.0",
    "confirmationRuleVersion": "tinjau.confirm/2.0.0",
    "evidenceCommitment": "0xcad6db77aa45e876a560caa8d297d4e44b3a6b91075975b7205e079dca4e1f09",
    "reasonBits": 344340,
    "dataModeOnChain": "REPLAY",